{
  "version": "0.1",
  "product": { "name": "Acme API", "url": "https://acme.dev", "docs": "https://docs.acme.dev" },
  "support": {
    "mcp": {
      "url": "https://acme.wellknown.support/mcp",
      "transport": "streamable-http",
      "auth": "none"
    }
  },
  "tools": ["ask", "escalate", "status"],
  "verification": { "levels": [0] },
  "contact": { "email": "support@acme.dev" },
  "updated": "2026-09-07",
  "provider": { "name": "Wellknown", "url": "https://wellknown.support" }
}
